title,formatoriginal,annotation,subject,publication,description,filename,imagelink,catalognum,creator,publisher,placeofpub,contribution,objectid,date,page,issue,latitude,longitude,collection,identifier,type,format,language,rights,rightsstatement
Big Hunt Without Kills,TIME Magazine Color Spreads,,Annual Bird Count;Birders;Audubon Society,TIME,"Bird watching, bird counts and declining species.",https://time.com/vault/issue/1955-01-10/page/66/,https://content.time.com/time/subscriber/vault/1955/01/19550110/66/1550.jpg,,"Alvin M. Josephy, Jr.",,,Producer,Big-Hunt-Without-Kills,1/10/1955,66,,,,TIME Color Spreads,Big-Hunt-Without-Kills,record,url,eng,,
Tree Farming:  The New Conservation,TIME Magazine Color Spreads,,Clear cutting;Tree farming;,TIME,Lumbermen have developed a new approach to save trees:  tree farming.,https://time.com/vault/issue/1955-01-17/page/84/,https://content.time.com/time/subscriber/vault/1955/01/19550117/85/1550.jpg,,"Alvin M. Josephy, Jr.",,,Producer,Tree-Farming-The-New-Conservation,1/17/1955,84,,,,TIME Color Spreads,Tree-Farming-The-New-Conservation,record,url,eng,,
The Way West,TIME Magazine Color Spreads,,Louisiana Purchase; George Catlin;Alfred Jacob Miller;Albert Bierstadt;George Caleb Bingham;Charles Wimar,TIME,Painters had a canvas from the Mississippi delta swamps to frozen peaks of the Rockies. ,https://time.com/vault/issue/1955-01-31/page/62,https://content.time.com/time/subscriber/vault/1955/01/19550131/63/1550.jpg,,"Alvin M. Josephy, Jr.",,,Producer,The-Way-West,1/31/1955,62,,,,TIME Color Spreads,The-Way-West,record,url,eng,,
Duke University ,TIME Magazine Color Spreads,,Duke Tobacco fortune;Trinity College,TIME,Description and photographs of Duke University.,https://time.com/vault/issue/1955-02-07/page/44/,https://content.time.com/time/subscriber/vault/1955/02/19550207/44/1550.jpg,,"Alvin M. Josephy, Jr.",,,Producer,Duke-University-,2/7/1955,44,,,,TIME Color Spreads,Duke-University-,record,url,eng,,
Venezuela:  Skipper of the Dreamboat,TIME Magazine Color Spreads,,Building boom;Oil;Military rule;Army Revolt;President Pérez Jiménez;Pedro Estrada;Financial mismanagement;,TIME,"In the throbbing boomland, the spectacular is commonplace.",https://time.com/vault/issue/1955-02-28/page/24/,https://content.time.com/time/subscriber/vault/1955/02/19550228/25/1550.jpg,,"Alvin M. Josephy, Jr.",,,Producer,Venezuela-Skipper-of-the-Dreamboat,2/28/1955,24,,,,TIME Color Spreads,Venezuela-Skipper-of-the-Dreamboat,record,url,eng,,
Modern Motels: The Boom That Travelers Built,TIME Magazine Color Spreads,,Motel boom;Higher auto sales;,TIME,The growth of modern motels.,https://time.com/vault/issue/1955-03-14/page/100/,https://content.time.com/time/subscriber/vault/1955/03/19550314/101/1550.jpg,,"Alvin M. Josephy, Jr.",,,Producer,Modern-Motels-The-Boom-That-Travelers-Built,3/14/1955,100,,,,TIME Color Spreads,Modern-Motels-The-Boom-That-Travelers-Built,record,url,eng,,
Manhatten:  City of Lights and Towers,TIME Magazine Color Spreads,,Subways;Skyscrapers;,TIME,Modern Manhatten.,https://time.com/vault/issue/1955-03-28/page/22/,https://content.time.com/time/subscriber/vault/1955/03/19550328/22/1550.jpg,,"Alvin M. Josephy, Jr.",,,Producer,Manhatten-City-of-Lights-and-Towers,3/28/1955,22,,,,TIME Color Spreads,Manhatten-City-of-Lights-and-Towers,record,url,eng,,
Religion:  Laborare Est Orare,TIME Magazine Color Spreads,,Monastic Orders;St. Augustine;Vocation;Three vows;,TIME,"Mother General Mary Columba, head of the U.S.'s biggest, most active, Roman Catholic women's missionary order. ",https://time.com/vault/issue/1955-04-11/page/78/,https://content.time.com/time/subscriber/vault/1955/04/19550411/79/1550.jpg,,"Alvin M. Josephy, Jr.",,,Producer,Religion-Laborare-Est-Orare,4/11/1955,78,,,,TIME Color Spreads,Religion-Laborare-Est-Orare,record,url,eng,,
Formosa:  Man of the Single Truth,TIME Magazine Color Spreads,,Nationalist China;Chiang Kai-shek;US Protection;,TIME,"Chiang Kai-shek, the President of Nationalist China.",https://time.com/vault/issue/1955-04-18/page/34/,https://content.time.com/time/subscriber/vault/1955/04/19550418/37/1550.jpg,,"Alvin M. Josephy, Jr.",,,Producer,Formosa-Man-of-the-Single-Truth,4/18/1955,34,,,,TIME Color Spreads,Formosa-Man-of-the-Single-Truth,record,url,eng,,
"Art:  The Pursuit of ""IT""",TIME Magazine Color Spreads,,Ecstacy;Art collecting;Art scholarship,TIME,Critic Bernard Berenson,https://time.com/vault/issue/1955-04-25/page/82/,https://content.time.com/time/subscriber/vault/1955/04/19550425/82/1550.jpg,,"Alvin M. Josephy, Jr.",,,Producer,Art-The-Pursuit-of-IT-,4/25/1955,82,,,,TIME Color Spreads,Art-The-Pursuit-of-IT-,record,url,eng,,
Education:  The Purists,TIME Magazine Color Spreads,,Lee Alvin DuBridge;Caltech;Nobel Prize winners;Competition;Science;Engineering;,TIME,Cal-Tech University,https://time.com/vault/issue/1955-05-16/page/70/,https://content.time.com/time/subscriber/vault/1955/05/19550516/71/1550.jpg,,"Alvin M. Josephy, Jr.",,,Producer,Education-The-Purists,5/16/1955,70,,,,TIME Color Spreads,Education-The-Purists,record,url,eng,,
Art: Salute to an Old Spring,TIME Magazine Color Spreads,,20th Century art pioneers;Wassily Kandinsky;Giorgio de Chirico;George Luks;Oskar Kokoschka,TIME,Post-war artists on view at the Modern and the Whitney,https://time.com/vault/issue/1955-05-23/page/68/,https://content.time.com/time/subscriber/vault/1955/05/19550523/69/1550.jpg,,"Alvin M. Josephy, Jr.",,,Producer,Art-Salute-to-an-Old-Spring,5/23/1955,68,,,,TIME Color Spreads,Art-Salute-to-an-Old-Spring,record,url,eng,,
The Hemisphere:  St. Lawrence Seaway,TIME Magazine Color Spreads,,Inland waterway;Economic impact;Geographical impact;Jacque Cartier;,TIME,Description and photographs of St. Lawrence Seaway.,https://time.com/vault/issue/1955-06-06/page/42/,https://content.time.com/time/subscriber/vault/1955/06/19550606/42/1550.jpg,,"Alvin M. Josephy, Jr.",,,Producer,The-Hemisphere-St-Lawrence-Seaway,6/6/1955,42,,,,TIME Color Spreads,The-Hemisphere-St-Lawrence-Seaway,record,url,eng,,
Art:  Water and Bronze ,TIME Magazine Color Spreads,,Carl Milles;,TIME,Sculptor Carl Milles and his sculptures. ,https://time.com/vault/issue/1955-06-27/page/74/,https://content.time.com/time/subscriber/vault/1955/06/19550627/74/1550.jpg,,"Alvin M. Josephy, Jr.",,,Producer,Art-Water-and-Bronze-,6/27/1955,74,,,,TIME Color Spreads,Art-Water-and-Bronze-,record,url,eng,,
Automation on the Farm,TIME Magazine Color Spreads,,Farm automation;Mechanical harvesting;,TIME,Tractors have become the next big thing in the farming industry.,https://time.com/vault/issue/1955-07-04/page/52/,https://content.time.com/time/subscriber/vault/1955/07/19550704/53/1550.jpg,,"Alvin M. Josephy, Jr.",,,Producer,Automation-on-the-Farm,7/4/1955,52,,,,TIME Color Spreads,Automation-on-the-Farm,record,url,eng,,
Art:  Pictures for the Nation ,TIME Magazine Color Spreads,,National Gallery of Art;Samuel H. Kres Collection;,TIME,Washington's National Gallery is deep in plans for its birthday celebration. ,https://time.com/vault/issue/1955-07-18/page/70/,https://content.time.com/time/subscriber/vault/1955/07/19550718/70/1550.jpg,,"Alvin M. Josephy, Jr.",,,Producer,Art-Pictures-for-the-Nation-,7/18/1955,70,,,,TIME Color Spreads,Art-Pictures-for-the-Nation-,record,url,eng,,
"The American Desert, 1955:  A New Way of Life in the U.S.",TIME Magazine Color Spreads,,Mineral riches;Fertile farmland;Pure water;Population growth;Resorts;Irrigation;,TIME,Description and photographs of various different desert towns in the U.S. ,https://time.com/vault/issue/1955-07-25/page/46/,https://content.time.com/time/subscriber/vault/1955/07/19550725/46/1550.jpg,,"Alvin M. Josephy, Jr.",,,Producer,The-American-Desert-1955-A-New-Way-of-Life-in-the-U-S-,7/25/1955,46,,,,TIME Color Spreads,The-American-Desert-1955-A-New-Way-of-Life-in-the-U-S-,record,url,eng,,
Inside Red China's Capital ,TIME Magazine Color Spreads,,Walled cities;Imperial City; Forbidden City;Population growth;Blue dungarees;,TIME,"Peking, past and present.",https://time.com/vault/issue/1955-08-08/page/24/,https://content.time.com/time/subscriber/vault/1955/08/19550808/25/1550.jpg,,"Alvin M. Josephy, Jr.",,,Producer,Inside-Red-China-s-Capital-,8/8/1955,24,,,,TIME Color Spreads,Inside-Red-China-s-Capital-,record,url,eng,,
Metal Sculpture:  Machine-Age Art,TIME Magazine Color Spreads,,Welded sculpture;Walter Gropius;Marcel Breuer;Eero Saarinen;David Hare; Herbert Ferber;Alexander Calder;Seymor Lipton; Richard Lippold; Theodore Roszak;Tom Hardy,TIME,Description of various artists who use metal in their scupltures.,https://time.com/vault/issue/1955-08-15/page/54/,https://content.time.com/time/subscriber/vault/1955/08/19550815/54/1550.jpg,,"Alvin M. Josephy, Jr.",,,Producer,Metal-Sculpture-Machine-Age-Art,8/15/1955,54,,,,TIME Color Spreads,Metal-Sculpture-Machine-Age-Art,record,url,eng,,
Art:  The Deathless Ones,TIME Magazine Color Spreads,,Ancient art;Resoration;Pagan art;Art market boom;,TIME," U.S. tourists swarm through Italy in greater numbers than ever, and keep coming across pagan deities. ",https://time.com/vault/issue/1955-08-29/page/62/,https://content.time.com/time/subscriber/vault/1955/08/19550829/63/1550.jpg,,"Alvin M. Josephy, Jr.",,,Producer,Art-The-Deathless-Ones,8/29/1955,62,,,,TIME Color Spreads,Art-The-Deathless-Ones,record,url,eng,,
Sport:  In the Saddle,TIME Magazine Color Spreads,,Pleasure riding;,TIME,American horse breeds.,https://time.com/vault/issue/1955-09-05/page/42/,https://content.time.com/time/subscriber/vault/1955/09/19550905/43/1550.jpg,,"Alvin M. Josephy, Jr.",,,Producer,Sport-In-the-Saddle,9/5/1955,42,,,,TIME Color Spreads,Sport-In-the-Saddle,record,url,eng,,
The New Churches,TIME Magazine Color Spreads,,Parabolas;Clear glass;Gables,TIME,The U.S. is whitnessing the greatest church-building boom in its history. ,https://time.com/vault/issue/1955-09-19/page/78/,https://content.time.com/time/subscriber/vault/1955/09/19550919/79/1550.jpg,,"Alvin M. Josephy, Jr.",,,Producer,The-New-Churches,9/19/1955,78,,,,TIME Color Spreads,The-New-Churches,record,url,eng,,
"""By Land From the U. States in 1804 and 1805"" with Meriwether Lewis and William Clark",TIME Magazine Color Spreads,,Corps of Discovery;150th Anniversary;York;Sacagawea;Mouth of the Columbia;,TIME,"Lewis and Clark expedition, the most exciting travel drama in US history. ",https://time.com/vault/issue/1955-10-10/page/66/,https://content.time.com/time/subscriber/vault/1955/10/19551010/66/1550.jpg,,"Alvin M. Josephy, Jr.",,,Producer,-By-Land-From-the-U-States-in-1804-and-1805-with-Meriwether-Lewis-and-William-Clark,10/10/1955,66,,,,TIME Color Spreads,-By-Land-From-the-U-States-in-1804-and-1805-with-Meriwether-Lewis-and-William-Clark,record,url,eng,,
Sport:  Big Game in the U.S. ,TIME Magazine Color Spreads,,Deer;Moose;Elk;Antelope;Big Horn sheep;Mountain goat;Bear;Increasing supply;Wolves;Coyotes;Wildcats;Cashmere underwear;,TIME,"Every fall, 5,000,000 Americans change into their hunting attire and head for the mountains to hunt big game. ",https://time.com/vault/issue/1955-11-07/page/90/,https://content.time.com/time/subscriber/vault/1955/11/19551107/90/1550.jpg,,"Alvin M. Josephy, Jr.",,,Producer,Sport-Big-Game-in-the-U-S-,11/7/1955,90,,,,TIME Color Spreads,Sport-Big-Game-in-the-U-S-,record,url,eng,,
Moscow for the Tourist ,TIME Magazine Color Spreads,,Chaotic auto traffic;Skyscrapers;Intourist travel organization;Glum faces;,TIME,Description and photographs of Moscow. ,https://time.com/vault/issue/1955-11-28/page/54/,https://content.time.com/time/subscriber/vault/1955/11/19551128/54/1550.jpg,,"Alvin M. Josephy, Jr.",,,Producer,Moscow-for-the-Tourist-,11/28/1955,54,,,,TIME Color Spreads,Moscow-for-the-Tourist-,record,url,eng,,
Science:  Pioneers in Space - Air Force Scientists Face the Unknown ,TIME Magazine Color Spreads,,Human tests;Research rockets;Space biology;Hypersonic tunnels;Flight simulation;Specialized equipment,TIME,The Air Force pioneers who push frontiers of knowledge on dozens of fronts.,http://time.com/vault/issue/1955-12-19/page/74/,https://content.time.com/time/subscriber/vault/1955/12/19551219/75/1550.jpg,,"Alvin M. Josephy, Jr.",,,Producer,Science-Pioneers-in-Space-Air-Force-Scientists-Face-the-Unknown-,12/19/1955,74,,,,TIME Color Spreads,Science-Pioneers-in-Space-Air-Force-Scientists-Face-the-Unknown-,record,url,eng,,
Hong Kong: Main Door to Communist China,TIME Magazine Color Spreads,,Economic make-over;Chinese refugees;British Crown colony;British Governor,TIME,Description and photographs of Hong Kong.,https://time.com/vault/issue/1956-01-16/page/52/,https://content.time.com/time/subscriber/vault/1956/01/19560116/52/1550.jpg,,"Alvin M. Josephy, Jr.",,,Producer,Hong-Kong-Main-Door-to-Communist-China,1/16/1956,52,,,,TIME Color Spreads,Hong-Kong-Main-Door-to-Communist-China,record,url,eng,,
Art:  The Age of Experiment ,TIME Magazine Color Spreads,,Edouard Manet;Artistic revolution;Mark Tobey;Marsden Hartley;Stuart Davis;Hans Hofmann;Lyonel Feininger;Arthur Dove;Georgia O'Keefe;Charles Sheeler;,TIME,"Manet was not the last great western painter, he was the first.",https://time.com/vault/issue/1956-02-13/page/64,https://content.time.com/time/subscriber/vault/1956/02/19560213/65/1550.jpg,,"Alvin M. Josephy, Jr.",,,Producer,Art-The-Age-of-Experiment-,2/13/1956,64,,,,TIME Color Spreads,Art-The-Age-of-Experiment-,record,url,eng,,
Art:  The Wild Ones ,TIME Magazine Color Spreads,,Young pioneers;Jackson Pollack;Willem de Kooning;Adolph Gottlieb;Robert Motherwell;Arshile Gorky;Philip Guston;William Baziotes;Mark Rothko;,TIME,"Modern artists who followed the lead of Kandinsky, Picasso and Klee.",https://time.com/vault/issue/1956-02-20/page/72/,https://content.time.com/time/subscriber/vault/1956/02/19560220/73/1550.jpg,,"Alvin M. Josephy, Jr.",,,Producer,Art-The-Wild-Ones-,2/20/1956,72,,,,TIME Color Spreads,Art-The-Wild-Ones-,record,url,eng,,
The US Air Force:  The Nation's Youngest Service Has Entered The Supersonic Age ,TIME Magazine Color Spreads,,Supersonic planes;Professionalism; Ethics; Discipline,TIME,The modern Air Force.,https://time.com/vault/issue/1956-03-05/page/58/,https://content.time.com/time/subscriber/vault/1956/03/19560305/58/1550.jpg,,"Alvin M. Josephy, Jr.",,,Producer,The-US-Air-Force-The-Nation-s-Youngest-Service-Has-Entered-The-Supersonic-Age-,3/5/1956,58,,,,TIME Color Spreads,The-US-Air-Force-The-Nation-s-Youngest-Service-Has-Entered-The-Supersonic-Age-,record,url,eng,,
"Jerusalem: Easter, 1956",TIME Magazine Color Spreads,,Christian pilgrims; Moslem-Jewish conflict;Professor John Marc Allegro,TIME,"The divide between the Old City of Jerusalem and the New, no peace",https://time.com/vault/issue/1956-04-02/page/68/,https://content.time.com/time/subscriber/vault/1956/04/19560402/68/1550.jpg,,"Alvin M. Josephy, Jr.",,,Producer,Jerusalem-Easter-1956,4/2/1956,68,,,,TIME Color Spreads,Jerusalem-Easter-1956,record,url,eng,,
Travel:  Host with the Most,TIME Magazine Color Spreads,,American Express;Massive tourism;Foreign independent tours;Ralph Reed;WW2 impact;Far East travel;,TIME,"The greatest number of travelers since the war will be vacationing this year, with the help of American Express.",https://time.com/vault/issue/1956-04-09/page/88/,https://content.time.com/time/subscriber/vault/1956/04/19560409/90/1550.jpg,,"Alvin M. Josephy, Jr.",,,Producer,Travel-Host-with-the-Most,4/9/1956,88,,,,TIME Color Spreads,Travel-Host-with-the-Most,record,url,eng,,
The Golden Calf,TIME Magazine Color Spreads,,Dropping prices;Shifting eating habits;Foreign breeds;Artificial insemination;Leaner meat;,TIME,US cattlemen over-invested in large herds and the price of beef has dropped significantly.,https://time.com/vault/issue/1956-05-07/page/100/,https://content.time.com/time/subscriber/vault/1956/05/19560507/100/1550.jpg,,"Alvin M. Josephy, Jr.",,,Producer,The-Golden-Calf,5/7/1956,100,,,,TIME Color Spreads,The-Golden-Calf,record,url,eng,,
Armed Forces:  The Admiral and the Atom,TIME Magazine Color Spreads,,Admiral Arleigh Burke;Nuclear energy;Nuclear submarines;Captain Hyman Rickover;Guided missiles;Supercarriers;WW2;,TIME,The modern Navy.,https://time.com/vault/issue/1956-05-21/page/27/,https://content.time.com/time/subscriber/vault/1956/05/19560521/30/1550.jpg,,"Alvin M. Josephy, Jr.",,,Producer,Armed-Forces-The-Admiral-and-the-Atom,5/11/1956,27,,,,TIME Color Spreads,Armed-Forces-The-Admiral-and-the-Atom,record,url,eng,,
The Civil War:  On Memorial Day the Memory is Alive and Vital ,TIME Magazine Color Spreads,,The Civil War,TIME,Remembering the Civil War on Memorial Day.,https://time.com/vault/issue/1956-06-04/page/28/,https://content.time.com/time/subscriber/vault/1956/06/19560604/28/1550.jpg,,"Alvin M. Josephy, Jr.",,,Producer,The-Civil-War-On-Memorial-Day-the-Memory-is-Alive-and-Vital-,6/4/1956,28,,,,TIME Color Spreads,The-Civil-War-On-Memorial-Day-the-Memory-is-Alive-and-Vital-,record,url,eng,,
Art:  The Maturing Modern ,TIME Magazine Color Spreads,,Eero Saarinen;Frank Lloyd Wright;Le Corbusier;Walter Gropius;Mies van der Rohe;Marcel Breuer;Richard Neutra;Wallace Harrison;Gordon Bunshaft;Philip Johnson;I. M. Pei;Paul Rudolph;Buckminster Fuller;Eduardo Catalano,TIME,Modern architecture is blooming.,https://time.com/vault/issue/1956-07-02/page/54,https://content.time.com/time/subscriber/vault/1956/07/19560702/57/1550.jpg,,"Alvin M. Josephy, Jr.",,,Producer,Art-The-Maturing-Modern-,7/2/1956,54,,,,TIME Color Spreads,Art-The-Maturing-Modern-,record,url,eng,,
National Parks: The U.S.'s Time Dimension ,TIME Magazine Color Spreads,,National Parks;National Monuments,TIME,High visitation numbers in the National Parks.,https://time.com/vault/issue/1956-07-23/page/18,https://content.time.com/time/subscriber/vault/1956/07/19560723/18/1550.jpg,,"Alvin M. Josephy, Jr.",,,Producer,National-Parks-The-U-S-s-Time-Dimension-,7/23/1956,18,,,,TIME Color Spreads,National-Parks-The-U-S-s-Time-Dimension-,record,url,eng,,
Shipping:  The New Argonauts,TIME Magazine Color Spreads,,Stavros Niarchos;Representative Joseph Casey;Aristotle Onassis;,TIME,Stavros Spyros Niarchos and his ship empire.,https://time.com/vault/issue/1956-08-06/page/57/,https://content.time.com/time/subscriber/vault/1956/08/19560806/59/1550.jpg,,"Alvin M. Josephy, Jr.",,,Producer,Shipping-The-New-Argonauts,8/6/1956,57,,,,TIME Color Spreads,Shipping-The-New-Argonauts,record,url,eng,,
Ancient Empires ,TIME Magazine Color Spreads,,Egypt;Assyria;Persia;Carthage;Rome;Islam;Charlemagne;,TIME,Empires of the Middle East.,https://time.com/vault/issue/1956-08-20/page/29/,https://content.time.com/time/subscriber/vault/1956/08/19560820/29/1550.jpg,,"Alvin M. Josephy, Jr.",,,Producer,Ancient-Empires-,8/20/1956,29,,,,TIME Color Spreads,Ancient-Empires-,record,url,eng,,
The Intracoastal Waterway,TIME Magazine Color Spreads,,US Gulf Coast;C. S. E. Holland;,TIME,"The critical muddy coastal waterway of 1116 miles between Brownsville, Texas and St. Marks, Florida.",https://time.com/vault/issue/1956-10-01/page/84/,https://content.time.com/time/subscriber/vault/1956/10/19561001/84/1550.jpg,,"Alvin M. Josephy, Jr.",,,Producer,The-Intracoastal-Waterway,10/1/1956,84,,,,TIME Color Spreads,The-Intracoastal-Waterway,record,url,eng,,
Sports:  Driving Man ,TIME Magazine Color Spreads,,Coach Hugh Duffy Daugherty;Michigan State University;,TIME,Michigan State football.,https://time.com/vault/issue/1956-10-08/page/68/,https://content.time.com/time/subscriber/vault/1956/10/19561008/69/1550.jpg,,"Alvin M. Josephy, Jr.",,,Producer,Sports-Driving-Man-,10/8/1956,68,,,,TIME Color Spreads,Sports-Driving-Man-,record,url,eng,,
Burgundy: The Purple Harvest Comes In,TIME Magazine Color Spreads,,Wine;Adverse weather;,TIME,1956 is a bad year for all of western Europe's vineyards.,https://time.com/vault/issue/1956-10-29/page/36/,https://content.time.com/time/subscriber/vault/1956/10/19561029/36/1550.jpg,,"Alvin M. Josephy, Jr.",,,Producer,Burgundy-The-Purple-Harvest-Comes-In,10/29/1956,36,,,,TIME Color Spreads,Burgundy-The-Purple-Harvest-Comes-In,record,url,eng,,
The PRESIDENTS of the US,TIME Magazine Color Spreads,,Dallas Museum of Fine Arts;Presidential portraits,TIME,"The presidents, from Washington to Eisenhower.",https://time.com/vault/issue/1956-11-12/page/27/,https://content.time.com/time/subscriber/vault/1956/11/19561112/27/1550.jpg,,"Alvin M. Josephy, Jr.",,,Producer,The-PRESIDENTS-of-the-US,11/12/1956,27,,,,TIME Color Spreads,The-PRESIDENTS-of-the-US,record,url,eng,,
Science:  Man's Milieu,TIME Magazine Color Spreads,,Weather forecasting;Carl-Gustaf Rossby;Cyclones;WW2;Computer forecasting;,TIME,Modern Meterology.,https://time.com/vault/issue/1956-12-17/page/70/,https://content.time.com/time/subscriber/vault/1956/12/19561217/74/1550.jpg,,"Alvin M. Josephy, Jr.",,,Producer,Science-Man-s-Milieu,12/17/1956,70,,,,TIME Color Spreads,Science-Man-s-Milieu,record,url,eng,,
Art:  The Silent Witness,TIME Magazine Color Spreads,,Edward Hopper;Realism;,TIME,Realist artistry draws inspiration  from everday experiences. ,https://time.com/vault/issue/1956-12-24/page/30/,https://content.time.com/time/subscriber/vault/1956/12/19561224/31/1550.jpg,,"Alvin M. Josephy, Jr.",,,Producer,Art-The-Silent-Witness,12/24/1956,30,,,,TIME Color Spreads,Art-The-Silent-Witness,record,url,eng,,
Exploration:  Compelling Continent ,TIME Magazine Color Spreads,,Antarctica;Paul Allman Siple;Scientific research;Operation Deep Freeze;,TIME,Antarctica and its conquest.,https://time.com/vault/issue/1956-12-31/page/14/,https://content.time.com/time/subscriber/vault/1956/12/19561231/15/1550.jpg,,"Alvin M. Josephy, Jr.",,,Producer,Exploration-Compelling-Continent-,12/31/1956,14,,,,TIME Color Spreads,Exploration-Compelling-Continent-,record,url,eng,,
Music on Broadway,TIME Magazine Color Spreads,,Musical comedies;,TIME,Musicals are in box office boom times.,https://time.com/vault/issue/1957-02-25/page/54/,https://content.time.com/time/subscriber/vault/1957/02/19570225/55/1550.jpg,,"Alvin M. Josephy, Jr.",,,Producer,Music-on-Broadway,2/25/1957,54,,,,TIME Color Spreads,Music-on-Broadway,record,url,eng,,
The World at Worship,TIME Magazine Color Spreads,,Global religions,TIME,"A new book, The World's Great Religions, covers the breadth of the world's religions.",https://time.com/vault/issue/1957-03-11/page/64/,https://content.time.com/time/subscriber/vault/1957/03/19570311/65/1550.jpg,,"Alvin M. Josephy, Jr.",,,Producer,The-World-at-Worship,3/11/1957,64,,,,TIME Color Spreads,The-World-at-Worship,record,url,eng,,
Surgery's New Frontier,TIME Magazine Color Spreads,,Heart surgery;Heart defects;Hahnemann Medical Center;Dr. Charles Bailey,TIME,The frontiers in heart surgery advanced by Dr. Charles Bailey.,https://time.com/vault/issue/1957-03-25/page/68/,https://content.time.com/time/subscriber/vault/1957/03/19570325/69/1550.jpg,,"Alvin M. Josephy, Jr.",,,Producer,Surgery-s-New-Frontier,3/25/1957,68,,,,TIME Color Spreads,Surgery-s-New-Frontier,record,url,eng,,
Masterpieces of Chinese Art ,TIME Magazine Color Spreads,,Peking Palace Museum;Nanking Central Museum;T'ang Dynesty;Sung Emperors;Kubla Khan;T'ang Yin;Ch'iu Ying;Shen Chou;Lu Chi;,TIME,"Chinese Art, spirited away from mainland China ahead of the Communist take-over, is on view on the island of Formosa.",https://time.com/vault/issue/1957-05-06/page/58/,https://content.time.com/time/subscriber/vault/1957/05/19570506/58/1550.jpg,,"Alvin M. Josephy, Jr.",,,Producer,Masterpieces-of-Chinese-Art-,5/6/1957,58,,,,TIME Color Spreads,Masterpieces-of-Chinese-Art-,record,url,eng,,
Middle Africa:  Cradle of Tomorrow,TIME Magazine Color Spreads,,White dominance;Native self-governance;,TIME,"Countries in middle Africa (north of South Africa, and south of Saharan Africa), are obtaining their independence.",https://time.com/vault/issue/1957-05-20/page/66/,https://content.time.com/time/subscriber/vault/1957/05/19570520/66/1550.jpg,,"Alvin M. Josephy, Jr.",,,Producer,Middle-Africa-Cradle-of-Tomorrow,5/20/1957,66,"Vol. LXIX, No. 20",,,TIME Color Spreads,Middle-Africa-Cradle-of-Tomorrow,record,url,eng,,
"Picasso, Protean Genius of Modern Art",TIME Magazine Color Spreads,,Picasso;Modern art,TIME,The Museum of Modern Art in NY hosts a 75th birthday celebration for Picasso with an exhibition of 328 of his works.,https://time.com/vault/issue/1957-05-27/page/82/,https://content.time.com/time/subscriber/vault/1957/05/19570527/83/1550.jpg,,"Alvin M. Josephy, Jr.",,,Producer,Picasso-Protean-Genius-of-Modern-Art,5/27/1957,82,"Vol. LXIX, No. 21",,,TIME Color Spreads,Picasso-Protean-Genius-of-Modern-Art,record,url,eng,,
"Battle of Midway:  June 4, 1942",TIME Magazine Color Spreads,,Battle of Midway;Admiral Chester Nimitz;Admiral Isoroku Yamamoto;,TIME,The decisive battle of Midway that turned the tide of the Pacifica Theater in World War 2.,https://time.com/vault/issue/1957-06-10/page/29/,https://content.time.com/time/subscriber/vault/1957/06/19570610/29/1550.jpg,,"Alvin M. Josephy, Jr.",,,Producer,Battle-of-Midway-June-4-1942,6/10/1957,29,"Vol. LXIX, No. 23",,,TIME Color Spreads,Battle-of-Midway-June-4-1942,record,url,eng,,
"Construction, March of the Monsters",TIME Magazine Color Spreads,,Interstate highways;Road-building machine industry;Caterpillar Tractor Company;WW2;Competition,TIME,The development of the Interstate highway system and the big machines required to build it.,https://time.com/vault/issue/1957-06-24/page/94/,https://content.time.com/time/subscriber/vault/1957/06/19570624/95/1550.jpg,,"Alvin M. Josephy, Jr.",,,Producer,Construction-March-of-the-Monsters,6/24/1957,94,"Vol. LXIX, NO. 25",,,TIME Color Spreads,Construction-March-of-the-Monsters,record,url,eng,,
