title,formatoriginal,annotation,subject,publication,description,filename,imagelink,catalognum,creator,publisher,placeofpub,contribution,objectid,date,page,issue,latitude,longitude,collection,identifier,type,format,language,rights,rightsstatement
Red Power: The American Indians’ Fight for Freedom,books;introductions,"Alvin actually edited this book and wrote the introduction, although he is listed as author. It contains essays and primary documents, mostly written by Indians, of what became known as the Red Power Movement, the right of Indians to “run their own affairs.”",American Indian general; Indian-white relations; indian public policy,,,,https://library.josephy.org/wp-content/uploads/2020/08/redPower.jpg,,Alvin M. Josephy Jr. (ed),American Heritage Press and McGraw-Hill editions,New York; NY,contributor;editor,Red-Power-The-American-Indians-Fight-for-Freedom,1971,,,,,"Alvin Josephy, Jr. Annotated Bibliography",Red-Power-The-American-Indians-Fight-for-Freedom,record,listing,eng,,
Red Power: The American Indians Fight for Freedom (New Revised),books;introductions,This is a much-expanded edition of the book twenty-eight years after it first appeared. A large collection of primary documents in Indians’ quest for recognition and power over that period of time.,American Indian general; Indian-white relations; indian public policy,,,,,,Alvin M. Josephy Jr. (ed);Joane Nagel (ed);Troy Johnson (ed),University of Nebraska Press,Lincoln; NE,contributor;editor,Red-Power-The-American-Indians-Fight-for-Freedom-New-Revised-,1999,,,,,"Alvin Josephy, Jr. Annotated Bibliography",Red-Power-The-American-Indians-Fight-for-Freedom-New-Revised-,record,listing,eng,,
Reference Encyclopedia of the American Indian,entries,"A catalog of information about Indians at the time with sections on books, newspapers and periodicals, reservations, tribal councils, etc. Extensive biography and bibliography of AMJ in the “Who’s Who” section: page 431.",native americans,,"Note: AJ included in Who’s Who"" section of prominent Indians and non-Indians active in Indian affairs and writers of their history""",,https://library.josephy.org/wp-content/uploads/2020/08/RefEncyAmIndian.jpg,393314,,B. Klein and Co.,,included,Reference-Encyclopedia-of-the-American-Indian,1967,,,,,"Alvin Josephy, Jr. Annotated Bibliography",Reference-Encyclopedia-of-the-American-Indian,record,url,eng,,
Reply to Dr. Haines,articles,"Josephy argues against Dr. Haines' claim that the Nez Perce tribes claimed Appaloosa as their warhorse. He provides examples of Haines' faulty arguments and habit of using previous statements as ""proof"" for his claims.  ",appaloosa; nez perce; native americans; warhorse; spotted horses; Umatilla,Westerners,"Alvin Josephy on Nez Perce and the Appaloosa, written for Westerners, Vol 15, No 1, beginning on page 15",,,,Alvin M. Josephy Jr.,,,author,Reply-to-Dr-Haines,1968-01-01,15,Vol 15; No 1,,,"Alvin Josephy, Jr. Annotated Bibliography",Reply-to-Dr-Haines,record,listing,eng,,
Revolt in the Pueblos,articles,"For 82 years, the Spanish reigned over the area of New Mexico. But in 1680, medicine man Popé united the Pueblo people using an ingenious way to get far-flung pueblos together to attack the Spanish on a certain date. The Puebloans successfully pushed the Spanish back across the Rio Grande and lived in freedom until 1692, when the Spanish regained control of the pueblos.",pueblo indians; uprising; war; native americans;Pueblo uprising; Popé; Origin story; Sipapu; Kivas; Cults and secret societies; atrocities; Francisco de Coronado; Don Juan de Oñate; Acoma Pueblo battle; slavery; ,American Heritage,"Alvin Josephy on Pueblo uprising of 1680, written for American Heritage, Vol 12, No 4, beginning on page 65",,,27951,Alvin M. Josephy Jr.,,,author,Revolt-in-the-Pueblos,1961-06-01,65,Vol 12; No 4,,,"Alvin Josephy, Jr. Annotated Bibliography",Revolt-in-the-Pueblos,record,url,eng,,
RFK: His Life and Death,books,"This book was published in 1968, soon after the assassination of Robert Kennedy.  It chronicles Robert Kennedy's life from non-politician, to politician to statesman. It includes 64 pages of pictures and a first-person account of Kennedy’s last 36 hours and the eulogy given by his brother, Senator Ted Kennedy.","American history general;Dynasty beginnings; war service; Sirhan Sirhan; Ralph Bunche; Senator Joseph McCarthy; James Hoffa; Martin Luther King, Jr.",,,,https://library.josephy.org/wp-content/uploads/2020/08/RFK.jpg,,Alvin M. Josephy Jr. (ed),Dell Publishing,New York; NY,editor,RFK-His-Life-and-Death,1968,,,,,"Alvin Josephy, Jr. Annotated Bibliography",RFK-His-Life-and-Death,record,listing,eng,,
Semper Fidelis,books,"In a book about the Marines in the Pacific Theatre of WW2, Alvin Josephy wrote and co-wrote 6 stories: one about a fresh soldier replacing a spent one; a second one about the intense fighting on Iwo Jima; another about the battalion medical section; a fourth about a Marine singing God Bless America to a dying comrade on a beach on the front line in Guam; A fifth about attemps to get Japaneses soldiers on Guam to surrender; and a final one about Marines being transported to cold temperatures after two years in the tropics.",,,,,,,,William Sloane Assoc.,New York; NY,contributor,Semper-Fidelis,1959,,,,,"Alvin Josephy, Jr. Annotated Bibliography",Semper-Fidelis,record,listing,eng,,
Sitting Bull and the Battle of the Little Bighorn,books;introductions,"This volume about Sitting Bull is one of 6 short, introductory books about famous Indian chieftains.", General George Crook; General George Custer; Hunkpapa Sioux; Sitting Bull (Tatanka Yotanka); Strong Hearts Warrior society; Powder River invasion; Chief Red Cloud; Father Pierre Jean DeSmet; 1868 Treaty of Fort Laramie; The Black Hills (Paha Sapa); The Battle of the Little Bighorn; Move to Canada; Return home; Buffalo Bill Cody; Wovoka; Ghost Dance; ,,"This volume is one of 6 in Alvin Josephy's Biography Series of American Indians.  Alvin wrote the introduction to this one, in which he makes the point that the discoverers of America were not the Europeans but the Indigenous people who arrived at least 10,000 years earlier.  Europeans never understood Indian culture and beliefs, but says this book elucidates these in the context of Sitting Bull's story.",,https://library.josephy.org/wp-content/uploads/2023/07/41J7a3zbnBL._SX218_BO1204203200_QL40_FMwebp_.jpg,,Shelia F. Black,Silver Burdett Press,Englewood Cliffs; NJ,introduction,Sitting-Bull-and-the-Battle-of-the-Little-Bighorn,1989,,,,,"Alvin Josephy, Jr. Annotated Bibliography",Sitting-Bull-and-the-Battle-of-the-Little-Bighorn,record,listing,eng,,
Some Aspects of Twentieth-Century Federal Indian Policy,books;chapters ,Papers and Proceedings of the National Archives Conference on Research in the History of Indian-White Relations; held in Washington D.C. in 1972. Josephy introduces section 6; on “Some Aspects of Twentieth Century Federal Indian Policy.”,,Indian-White Relations: A Persistent Paradox,,,https://library.josephy.org/wp-content/uploads/2020/08/IndianWhiteRelations.jpg,1841569,Jane F. Smith and Robert Kvasnicka (eds),Howard University Press,Washington; DC,item: 'Some Aspects of Twentieth-Century Federal Indian Policy',Some-Aspects-of-Twentieth-Century-Federal-Indian-Policy,1976,,,,,"Alvin Josephy, Jr. Annotated Bibliography",Some-Aspects-of-Twentieth-Century-Federal-Indian-Policy,record,url,eng,,
The American Heritage Book of Indians,books,"General history of American Indians written by many hands. Organized by AMJ, who I believe was also primarily responsible for gathering images for this richly illustrated volume, including some of the first European images of Indians.</span>",American history general; American Indian general,,,,https://library.josephy.org/wp-content/uploads/2020/08/AHIndians.jpg,376850,Alvin M. Josephy Jr. (ed),American Heritage Publishing. Co.,New York; NY,editor,The-American-Heritage-Book-of-Indians,1961,,,,,"Alvin Josephy, Jr. Annotated Bibliography",The-American-Heritage-Book-of-Indians,record,url,eng,,
The American Heritage Book of Natural Wonders,books,Chapters by Peter Matthiiessen; William O. Douglas; Jan de Hartog; Bruce Catton; Paul Engle; Wallace Stegner; Georg Stewart; and Harold Gilliam,Natural resources,,,,https://library.josephy.org/wp-content/uploads/2020/08/AmHerGdNaruralWonders.jpg,387304,Alvin M. Josephy Jr.,American Heritage Publishing. Co.,New York; NY,editor;co-author,The-American-Heritage-Book-of-Natural-Wonders,1963,,,,,"Alvin Josephy, Jr. Annotated Bibliography",The-American-Heritage-Book-of-Natural-Wonders,record,url,eng,,
The American Heritage History of Flight,books,"Written in 1962, this book describes air pioneers, the air battles of both World Wars, the first commercial air crews, military aviators, and the aviation technology explosion since WW2. Includes 75 interviews with American and European air pioneers, and over 400 prints, drawings and photographs of pilots and air vessels since the mythological ages.",Flying;WW1;WW2;Military use; Icarus; kites; Leonardo da Vinci; ballooning; Wright Brothers; air ships; Harriet Quimby; WWI; Air races; WW2; Supersonic flight,,,,https://library.josephy.org/wp-content/uploads/2020/08/AmHerHistFlight.jpg,151134,Alvin M. Josephy Jr. (ed),American Heritage Publishing. Co.,New York; NY,editor,The-American-Heritage-History-of-Flight,1963,,,,,"Alvin Josephy, Jr. Annotated Bibliography",The-American-Heritage-History-of-Flight,record,url,eng,,
The American Heritage History of the Congress of the United States,books,"A comprehensive history of the US Congress from its beginnings to the early 1970s. Alvin had worked inside the Kennedy Administration, been an advisor to government agencies, and once ran for Congress himself in Connecticut.",American history general,,,,https://library.josephy.org/wp-content/uploads/2020/08/AmHerHistCongress.png,64947,Alvin M. Josephy Jr.,American Heritage Publishing. Co.,New York; NY,author,The-American-Heritage-History-of-the-Congress-of-the-United-States,1975,,,,,"Alvin Josephy, Jr. Annotated Bibliography",The-American-Heritage-History-of-the-Congress-of-the-United-States,record,url,eng,,
The American Heritage History of the Great West,books,"A chronological history of the Westward Movement across North America from 1763 - 1914. The editor, David Lavender, was a popular history writer with several books on the West. AMJ led the American Heritage editors - there were art directors, map-makers, etc. - who followed the AH recipe for large, heavily illustrated popular histories.",American history general; American Indian general; Indian-white relations; Civil War;,,,,https://library.josephy.org/wp-content/uploads/2020/08/AmHerHiistoryGreatWest.jpg,7900,Alvin M. Josephy Jr. (ed),American Heritage Publishing. Co.,New York; NY,editor,The-American-Heritage-History-of-the-Great-West,1965,,,,,"Alvin Josephy, Jr. Annotated Bibliography",The-American-Heritage-History-of-the-Great-West,record,url,eng,,
The American Heritage History of World War I,books,A large volume that describes the shooting of  Archduke Francis Ferdinand and his wife Sophia,American history general; Politics,,,,https://library.josephy.org/wp-content/uploads/2023/07/51I1RkT8J5L.jpg,1994716,David Lavender (author);Alvin M. Josephy Jr. (ed),American Heritage Publishing. Co.,New York; NY,editor,The-American-Heritage-History-of-World-War-I,1964,,,,,"Alvin Josephy, Jr. Annotated Bibliography",The-American-Heritage-History-of-World-War-I,record,url,eng,,
The American Heritage Pictorial Atlas of United States History,books,AMJ is credited with being one of the “Chapter text” writers; but chapters are not signed. Imagine he wrote some of early chapters on pre-history; pre-colonization civilizations; into colonial period. And later chapter on the Western U.S.,American history general; Indian-white relations; Civil War;,,,,https://library.josephy.org/wp-content/uploads/2020/08/AmHerAtlasUSHistory.jpg,5634,Alvin M. Josephy Jr.,American Heritage Publishing. Co.,New York; NY,editor;co-author,The-American-Heritage-Pictorial-Atlas-of-United-States-History,1966,,,,,"Alvin Josephy, Jr. Annotated Bibliography",The-American-Heritage-Pictorial-Atlas-of-United-States-History,record,url,eng,,
The American Indian and Freedom of Religion: An Historic Appraisal,ephemera;presentations,"Josephy presented a paper on Indigenous religion and its role as a major force in both Indian culture and in relationships with non-Natives.  This is an announcement about the lecture.
","Pacific Northwest; Indian Spiritual Systems; Religious freedom.
",The Changing Pacific Northwest,,,,,David H. Stratton and George A. Frykman (eds),Washington State University Press,Pullman; WA,item: 'The American Indian and Freedom of Religion: An Historic Appraisal',The-American-Indian-and-Freedom-of-Religion-An-Historic-Appraisal,10/27/1982,,,,,"Alvin Josephy, Jr. Annotated Bibliography",The-American-Indian-and-Freedom-of-Religion-An-Historic-Appraisal,record,listing,eng,,
The American Indians,books;chapters ,,,Colliers Encyclopedia,,,,,Alvin M. Josephy Jr.,Colliers,,item: 'The American Indians',The-American-Indians,1963,,,,,"Alvin Josephy, Jr. Annotated Bibliography",The-American-Indians,record,listing,eng,,
The Artist Was a Young Man: The Life Story of Peter Rindisbacher,books,"The book was written to accompany an exhibit of Rindisbacher’s work that appeared at the Amon Carter Museum, Fort Worth. Rindisbacher was born in 1806 and died at 28, but his images of the Plains Indians were published early and remain iconic.",American Indian general; American History general; Switzerland; Red River Colony; Hudson's Bay Company; Prairie du Chien; early death,,Note: edition in French as well,,https://library.josephy.org/wp-content/uploads/2020/08/ArtistYoungMan.jpg,1283130,Alvin M. Josephy Jr.,Amon Carter Museum,Fort Worth; TX,author,The-Artist-Was-a-Young-Man-The-Life-Story-of-Peter-Rindisbacher,1970,,,,,"Alvin Josephy, Jr. Annotated Bibliography",The-Artist-Was-a-Young-Man-The-Life-Story-of-Peter-Rindisbacher,record,url,eng,,
The Birth of the National Park Service: The Founding Years; 1913-33,books,"AMJ is listed as “Acquiring Editor” for Institute of the American West Books, of which this is Volume Two in a series. Inscribed, “With thanks for your help in getting this published and in appreciation of your great efforts for the environmental movement and fine writing… Bob Cahn, December 1985.”",Natural resources;Horace Albright; Stephen Mather; Frederick Law Olmstead; Yellowstone; Yosemite; Glacier; Zion;  Grand Canyon;Grand Tetons; Hawaii National Park; Ranger mystique; National monuments;,,,,https://library.josephy.org/wp-content/uploads/2020/08/BirthNatParkService.jpg,304896,Alvin M. Josephy Jr. (ed),Institute of American West Books,,editor,The-Birth-of-the-National-Park-Service-The-Founding-Years-1913-33,1985,,,,,"Alvin Josephy, Jr. Annotated Bibliography",The-Birth-of-the-National-Park-Service-The-Founding-Years-1913-33,record,url,eng,,
The Blood of Abel: American West,articles,,idaho; lloyd magruder; murder; western justice,The American West,"Alvin Josephy on 1863 murder of Lloyd Magruder and swift justice in frontier Idaho, written for American West, Vol 20, No 3, beginning on page 31",,https://josephy.org/wp-content/uploads/2022/06/American_West.jpg,,Alvin M. Josephy Jr.,,,author,The-Blood-of-Abel-American-West,1983-05-01,31,Vol 20; No 3,,,"Alvin Josephy, Jr. Annotated Bibliography",The-Blood-of-Abel-American-West,record,listing,eng,,
The Blood of Abel: Journal,articles,"The 1863 brutal murder of Lloyd Magruder and companions rocked the new Idaho Territory with gruesome details and sensational solution. Magruder Mountain, 43  miles east of Elk City, bears the name. ",Lloyd Magruder; Magruder Mountain; Idaho gold; Lewiston Idaho; Elk City Idaho; Hill Beachy,Journal,"Alvin Josephy on 1863 murder of Lloyd Magruder and swift justice in frontier Idaho, written for Journal, Vol 4, No 1, beginning on page 4",,,,Alvin M. Josephy Jr.,,,author,The-Blood-of-Abel-Journal,1985-03-01,4,Vol 4; No 1,,,"Alvin Josephy, Jr. Annotated Bibliography",The-Blood-of-Abel-Journal,record,listing,eng,,
The Civil War: War on the Frontier,books,"The popularity of this book, and the realization that although much had been written about specific events in the West during the Civil War and immediately following the War - most of it in small and local museum and local history outlets - there was no book tying them together or tying Western History in general to the major Civil War events in the East caused AMJ and his publisher at Knopf to pursue the larger book.",American history general; American Indian general; Sioux; Indian-white relations; Indian public policy; Civil War; Atrocities against Indians; Indian uprisings,,,,,,Alvin M. Josephy Jr.,Time-Life Books,,author;editor,The-Civil-War-War-on-the-Frontier,1986,,,,,"Alvin Josephy, Jr. Annotated Bibliography",The-Civil-War-War-on-the-Frontier,record,listing,eng,,
The Civil War in the American West,books,"AMJ first wrote a shorter treatment of the Civil War in the West,<em>The Civil War: War on the Frontier</em>, as part of a huge Time-Life series on the Civil War in 1986. In this book he covers major campaigns and actions directly related to the War, those massacres of Indians at the hands of regular and recruited local troops, and the outbreaks that impacted the tribes specifically e.g. the Minnesota Uprising and the Union troops diverted to put it down. Overall, Josephy claims that “During the four years of the Civil War… more Indian tribes were destroyed by whites and more land was seized from them than in almost any other comparable time in American history.”",American history general; American Indian general; Sioux; Indian-white relations; Indian public policy; Civil War; Atrocities against Indians; Indian uprisings,,,,91807.jpg,91807,Alvin M. Josephy Jr.,Knopf,New York; NY,author,The-Civil-War-in-the-American-West,1991,,,,,"Alvin Josephy, Jr. Annotated Bibliography",The-Civil-War-in-the-American-West,record,url,eng,,
,,,,,,,,,,,,,,,,,,,,,,,,,
The Custer Myth,articles,"The Custer myth has the general and his brave soldiers surrounded and massacred by savage Sioux warriors. Custer's previous slaughter of innocent indians and the fact that he was violating a treaty as gold was discovered in the Black Hills was ignored. Josephy catalogs earlier Indian wars and taking of Indian lands, massacres of Indians, and the continuing quest for land and gold. Custer's defeat resulted in showing no mercy towards the Sioux in succeeding years, and promoted Indian-hating in general.",Indian wars; native americans; little bighorn; sioux; general custer; Crazy Horse; Little Big Man; Black Hills; Wounded Knee;,Life,"Alvin Josephy on The battle of Little Bighorn, written for Life, Vol 71, No. 1, beginning on page 49",,https://josephy.org/wp-content/uploads/2022/06/life.jpg,29312,Alvin M. Josephy Jr.,,,author,The-Custer-Myth,1971-07-02,49,Vol 71; No. 1,,,"Alvin Josephy, Jr. Annotated Bibliography",The-Custer-Myth,record,url,eng,,
The Funeral of Peter Dan Moses,articles,"A letter was sent to Josephy by Cull A White, resurfacing a positive relationship between settlers and Indians (on the Colville Reservation) that is rarely heard. Peter Moses was one of the very few respected and full blood Indian ranchers that took part in this positive experience.",Dan Moses; Colville reservation; indian-white relations; ranchers; cattle; horses; Potlatch; Chief Moses;Cull White,Westerners,"Alvin Josephy on The funeral of Peter Dan Moses marked the passing of another colorful, prominent NW Indian Leader, written for Westerners, Vol 9, No 3, beginning on page 64",,,,Cull A White; Alvin M. Josephy Jr.,,,author,The-Funeral-of-Peter-Dan-Moses,1962-01-01,64,Vol 9; No 3,,,"Alvin Josephy, Jr. Annotated Bibliography",The-Funeral-of-Peter-Dan-Moses,record,listing,eng,,
The Horizon History of Africa,books,A huge volume of the history of Africa from pre-historic times through the liberation movements against colonial rule in the 1960s.,,,,,https://library.josephy.org/wp-content/uploads/2023/02/africa.jpg,109199,Alvin M. Josephy Jr. (ed),American Heritage Publishing Co.,New York; NY,editor,The-Horizon-History-of-Africa,1971,,,,,"Alvin Josephy, Jr. Annotated Bibliography",The-Horizon-History-of-Africa,record,url,eng,,
The Horizon Book of Vanishing Primitive Man,books,A richly illustrated look at several remnant groups of very ancient cultures from around the world.,,,,,https://library.josephy.org/wp-content/uploads/2020/08/VanishingPrimitveMan.jpg,,Alvin M. Josephy Jr. (ed),American Heritage Publishing Co.,New York; NY,editor,The-Horizon-Book-of-Vanishing-Primitive-Man,1973,,,,,"Alvin Josephy, Jr. Annotated Bibliography",The-Horizon-Book-of-Vanishing-Primitive-Man,record,listing,eng,,
The Hudson's Bay Company and the American Indians,articles,"See ""By Fare and Gentle Means;"" in American West Magazine. Articles first appeared in The Westerners, in 3 issues, in 1971, and were combined, with new and generous illustrations, in American West; Vol 9; No 5; September; 1972. beginning on page 4.  The HBC, between 1670 and 1870, interacted with many tribes in Canada with restraint,  principled dealings and enforced rules.  HBC sought a commercial trading relationship with every tribe and the company was not there to conquer or take away land. But HBC supplied guns to the Indians which created warfare between the tribes and made trade dealings more difficult.", Canada; Hudson's Bay Compay; Harmonious relationships; fur trade; peacemaking activities; price lists; Overplus of Trade;,Westerners,,,,,Alvin M. Josephy Jr.,,,author,The-Hudson-s-Bay-Company-and-the-American-Indians,1971,28,Vol 18; No 2,,,"Alvin Josephy, Jr. Annotated Bibliography",The-Hudson-s-Bay-Company-and-the-American-Indians,record,listing,eng,,
The Hudson's Bay Company and the American Indians - II,articles,"Articles about the Hudson Bay Company and Indians first appeared in three 1971 issues of The Westerners.  They were then combined, with new and generous illustrations, in the article, ""By Fayre and Gentle Means"" in The American West; Vol 9; No 5; September; 1972.  Although HBC issued and enforced high standards of integrity when trading with Indians, by the 1770's, the company concluded it had to pay Indians with alcohol to retain their loyalty to HBC and not to their competitors.",Payment in alcohol; Hudson's Bay Company; North West Company;,Westerners,,,,,Alvin M. Josephy Jr.,,,author,The-Hudson-s-Bay-Company-and-the-American-Indians-II,1971,59,Vol 18; No 3,,,"Alvin Josephy, Jr. Annotated Bibliography",The-Hudson-s-Bay-Company-and-the-American-Indians-II,record,listing,eng,,
The Hudson's Bay Company and the American Indians - III,articles,"Articles about the Hudson Bay Company and Indians first appeared in three 1971 issues of The Westerners.  They were then combined, with new and generous illustrations, in the article, ""By Fayre and Gentle Means"" in The American West; Vol 9; No 5; September; 1972. The fur trade, with its payment in guns and alcohol, resulted in weakened tribal ties and culture, leaving the Indians unable to cope with the White settlers who followed the traders.",epidemic diseases; divide and conquer tactics; Rules for Indians; Indian dependency; Treaties;,Westerners,,,,,Alvin M. Josephy Jr.,,,author,The-Hudson-s-Bay-Company-and-the-American-Indians-III,1971,78,Vol 18; No 4,,,"Alvin Josephy, Jr. Annotated Bibliography",The-Hudson-s-Bay-Company-and-the-American-Indians-III,record,listing,eng,,
The Indian Heritage of America,books,"This book, published in 1968, was a finalist for the National Book Award. In discussing Indians of North, Central, and South America, and their relationships with colonizers from Columbus to modern times, Josephy relied on latest in linguistic and archeological research available at the time. He trusted tribal knowledge too, and spoke for Indians’ longer tenure and larger historical populations in the New World than most of his contemporaries. Events have confirmed his views, and the book remains in use as a textbook and primer in Indian studies.",American history general; Atrocities against Indians; Horses; Indian uprisings; Indian-White relations; native americans,,,,282213.jpg,282213,Alvin M. Josephy Jr.,Knopf,New York; NY,author,The-Indian-Heritage-of-America,1968,,,,,"Alvin Josephy, Jr. Annotated Bibliography",The-Indian-Heritage-of-America,record,url,eng,,
The Last Stand of Chief Joseph: American History,books;chapters  ,"In 1877, the US Army pursued the peaceful and diplomatic Nez Perce, chasing them out of their Oregon homeland and across 1300 miles of Idaho, Wyoming and Montana.  The Nez Perce were forced in Montana to give up their attempt to reach Canada and safety.  After devastating years in Indian Territory, the Chief Joseph band remnants of this war returned to the Colville reservation in Washington State.
",Atrocities against Indians;Indian uprisings;Indian-white relations;nez perce;Nez Perce War and Aftermath,The Sweep of American History; Volume II; Second Edition,"“The Last Stand of Chief Joseph” excerpted from <em>Patriot Chiefs</em>, pages 41-55.",,,,Alvin M. Josephy Jr.,John Wiley & Sons; Inc.,,item: 'The Last Stand of Chief Joseph',The-Last-Stand-of-Chief-Joseph-American-History,1974,,,,,"Alvin Josephy, Jr. Annotated Bibliography",The-Last-Stand-of-Chief-Joseph-American-History,record,listing,eng,,
